[
  {
    "date": "2026-03-14",
    "id": "DR-0001",
    "link_count": 1,
    "links": [
      {
        "artifact_kind": "document",
        "label": "Rationale doc",
        "ref": "path:docs/decision-tracking-rationale.md",
        "rel": "supported_by",
        "target": "artifact:c77f134f4b5b4464075e5543173c6f17845efd0a3be515bafe665362cd79d91b"
      }
    ],
    "owner": "ahmet",
    "scores": {
      "completeness": 1.0,
      "connectedness": 0.25,
      "inclusiveness": 0.667,
      "traceability": 0.333
    },
    "sections": {
      "Alternatives": "N/A",
      "Consequences": "- Better auditability and reproducibility\n- Requires discipline to keep records updated",
      "Context": "Decisions and rationale are scattered across commits and chats.",
      "Decision": "Store Decision Records (DRs) as Markdown + YAML in the repository.",
      "Rationale": "Git-native artifacts reduce friction and improve traceability."
    },
    "stage": "monitoring",
    "stakeholders": [
      "reviewer",
      "ML engineer"
    ],
    "status": "accepted",
    "title": "Introduce decision tracking artifacts in repo",
    "type": "generic"
  },
  {
    "date": "2026-03-14",
    "id": "DR-0002",
    "link_count": 2,
    "links": [
      {
        "artifact_kind": "code",
        "label": "Adds transformer model module",
        "ref": "git:commit:bb22cc3",
        "rel": "implements",
        "target": "artifact:abf7fdef7990fe095557154da35bf05fe7b0d4b4f43a275da4de190a188e7bf0"
      },
      {
        "artifact_kind": "document",
        "label": "Model selection notes",
        "ref": "path:docs/model-selection-notes.md",
        "rel": "supported_by",
        "target": "artifact:e55c39e4bbb617b3a9d270f18effdb8011728591de3f0937dc6b1fbd3a3b6439"
      }
    ],
    "owner": "ahmet",
    "scores": {
      "completeness": 1.0,
      "connectedness": 0.5,
      "inclusiveness": 0.667,
      "traceability": 0.5
    },
    "sections": {
      "Alternatives": "1) CNN text classifier\n2) BiLSTM with attention",
      "Consequences": "- Higher training cost\n- More hyperparameters to tune",
      "Context": "Existing baseline underperforms on minority classes.",
      "Decision": "Use a Transformer encoder as the baseline architecture.",
      "Rationale": "Better long-range dependency handling should improve minority-class performance."
    },
    "stage": "training",
    "stakeholders": [
      "supervisor",
      "ML engineer"
    ],
    "status": "accepted",
    "title": "Adopt Transformer encoder as baseline model",
    "type": "model"
  },
  {
    "date": "2026-03-14",
    "id": "DR-0003",
    "link_count": 3,
    "links": [
      {
        "artifact_kind": "experiment_run",
        "label": "Run evaluating stratified split",
        "ref": "mlflow:run:f3a0b0d1b2c34e",
        "rel": "evaluated_by",
        "target": "artifact:2f67da8bda404b8f74a79c78da749a538cd8d31d844f5eac6a9bf5f55c24007c"
      },
      {
        "artifact_kind": "code",
        "label": "Implements stratified split",
        "ref": "git:commit:cc11dd2",
        "rel": "implements",
        "target": "artifact:8630b895310f653cb8d1eb161eed7bc778c9a3e82888c24dd06b812dc197f507"
      },
      {
        "artifact_kind": "data",
        "label": "Dataset version used",
        "ref": "dvc:3f2c9a1",
        "rel": "supported_by",
        "target": "artifact:671ef6c0076d7a8822952826e3f5d6ad6a876db13e5f8dd4152156f71a34e172"
      }
    ],
    "owner": "ahmet",
    "scores": {
      "completeness": 1.0,
      "connectedness": 0.75,
      "inclusiveness": 0.667,
      "traceability": 0.75
    },
    "sections": {
      "Alternatives": "1) 80/20 stratified split\n2) k-fold cross-validation",
      "Consequences": "- Results become comparable across runs\n- Older baselines need re-running for fair comparison",
      "Context": "Evaluation results were unstable due to class imbalance and small test set.",
      "Decision": "Use stratified 70/30 split with a fixed seed (42) for dataset dvc:3f2c9a1.",
      "Rationale": "Stabilizes metric estimates while preserving enough training data."
    },
    "stage": "evaluation",
    "stakeholders": [
      "reviewer",
      "ML engineer"
    ],
    "status": "accepted",
    "title": "Switch evaluation to stratified 70/30 split with fixed seed",
    "type": "evaluation_protocol"
  },
  {
    "date": "2026-03-14",
    "id": "DR-0004",
    "link_count": 1,
    "links": [
      {
        "artifact_kind": "document",
        "label": "Dataset versioning notes",
        "ref": "path:docs/dataset-versioning-notes.md",
        "rel": "supported_by",
        "target": "artifact:bf1114203ff06de9010e5da12e1df6bb3a60049b0aa6ecea9913cd37d3592da2"
      }
    ],
    "owner": "ahmet",
    "scores": {
      "completeness": 1.0,
      "connectedness": 0.25,
      "inclusiveness": 0.333,
      "traceability": 0.333
    },
    "sections": {
      "Alternatives": "N/A",
      "Consequences": "- More explicit lineage\n- Requires maintaining dataset versioning discipline",
      "Context": "Data changes over time and evaluations become non-comparable.",
      "Decision": "Always reference a concrete dataset version/hash in evaluation decisions.",
      "Rationale": "Prevents silent data drift during experimentation."
    },
    "stage": "data",
    "stakeholders": [
      "ML engineer"
    ],
    "status": "superseded",
    "title": "Pin dataset version for all evaluations",
    "type": "generic"
  },
  {
    "date": "2026-03-14",
    "id": "DR-0005",
    "link_count": 2,
    "links": [
      {
        "artifact_kind": "document",
        "label": "Supersedes earlier rule",
        "ref": "decision:DR-0004",
        "rel": "supersedes",
        "target": "decision:DR-0004"
      },
      {
        "artifact_kind": "document",
        "label": "Template guidance",
        "ref": "path:docs/template-guidance.md",
        "rel": "supported_by",
        "target": "artifact:a58020d0da7d6079ff30fd5a52c9f80465098a241e086da746dad08d1dacdac7"
      }
    ],
    "owner": "ahmet",
    "scores": {
      "completeness": 1.0,
      "connectedness": 0.35,
      "inclusiveness": 0.667,
      "traceability": 0.667
    },
    "sections": {
      "Alternatives": "1) Keep DR-0004 as policy-only\n2) Add a lint rule without template changes",
      "Consequences": "- More consistent decision capture\n- Slightly more upfront documentation in eval decisions",
      "Context": "Generic rules were not consistently applied in practice.",
      "Decision": "Make dataset reference a mandatory field in the evaluation_protocol template.",
      "Rationale": "Template enforcement reduces omissions compared to a separate generic rule."
    },
    "stage": "monitoring",
    "stakeholders": [
      "reviewer",
      "ML engineer"
    ],
    "status": "accepted",
    "title": "Replace generic dataset pin rule with evaluation_protocol template requirement",
    "type": "generic"
  },
  {
    "date": "2026-03-14",
    "id": "DR-0006",
    "link_count": 0,
    "links": [],
    "owner": "ahmet",
    "scores": {
      "completeness": 1.0,
      "connectedness": 0.0,
      "inclusiveness": 1.0,
      "traceability": 0.0
    },
    "sections": {
      "Alternatives": "N/A",
      "Consequences": "- Potentially more iteration before acceptance\n- Might slow deployment if improvements are hard to achieve",
      "Context": "Recent runs suggest 0.75 is too lenient for deployment expectations.",
      "Decision": "Propose raising the acceptance threshold to 0.78 for F1.",
      "Rationale": "Higher threshold reduces risk of deploying underperforming models."
    },
    "stage": "evaluation",
    "stakeholders": [
      "supervisor",
      "reviewer",
      "ML engineer"
    ],
    "status": "proposed",
    "title": "Adjust F1 acceptance threshold from 0.75 to 0.78",
    "type": "evaluation_protocol"
  }
]
